{
  "actionId": "fixture-reference-fill",
  "targetAssetId": "asset-reference",
  "metadataKind": "reference-video.analysis",
  "producer": "fixture",
  "metadata": {
    "kind": "reference-video.analysis",
    "sourceUrl": "https://example.invalid/watch/1",
    "rights": {
      "license": "unknown",
      "attribution": "unknown",
      "redistributionAllowed": false,
      "derivativeAllowed": false
    },
    "shots": [
      { "id": "shot-1", "startFrame": 0, "endFrame": 60, "description": "Fast product push-in", "tags": ["push-in", "product"] }
    ],
    "nonCopyingQa": { "status": "requires-review", "similarityScore": 0.71 }
  }
}
