{
  "actionId": "fixture-talking-head-fill",
  "targetAssetId": "asset-talk",
  "metadataKind": "talking-head.analysis",
  "producer": "fixture",
  "metadata": {
    "kind": "talking-head.analysis",
    "fps": 30,
    "words": [
      { "id": "w1", "text": "Hello", "startFrame": 0, "endFrame": 12 },
      { "id": "w2", "text": "Clash", "startFrame": 12, "endFrame": 28 }
    ],
    "cuts": [
      { "id": "keep-1", "sourceStartFrame": 0, "sourceEndFrame": 60, "outputStartFrame": 0, "outputEndFrame": 60, "action": "keep" }
    ],
    "captionCues": [
      { "id": "cue-1", "startFrame": 0, "durationInFrames": 45, "text": "Hello Clash", "wordIds": ["w1", "w2"] }
    ],
    "disfluencies": [
      { "wordId": "w1", "type": "filler", "requiresReview": true }
    ]
  }
}
