{
  "actionId": "fixture-storyboard-fill",
  "targetAssetId": "asset-storyboard",
  "metadataKind": "image.storyboard-consistency",
  "producer": "fixture",
  "metadata": {
    "kind": "image.storyboard-consistency",
    "characters": [
      {
        "id": "hero",
        "name": "Store Clerk",
        "referenceAssetIds": ["asset-hero-front", "asset-hero-side", "asset-hero-back"],
        "requiredViews": ["front", "side", "back"]
      }
    ],
    "scenes": [
      { "id": "store-night", "referenceAssetIds": ["asset-store"], "prompt": "night convenience store aisle" }
    ],
    "panels": [
      {
        "id": "panel-1",
        "sceneId": "store-night",
        "characterIds": ["hero"],
        "assetId": "asset-panel-1",
        "path": "assets/storyboard/panel-1.png",
        "consistencyScore": 0.86
      }
    ]
  }
}
